{
  "timestamp": "2025-10-13T12:02:10Z",
  "request_id": "bb2c6b0b-7a2e-4b90-8a0a-eeeeeeeeeeee",
  "model": "gpt-4-turbo",
  "pipeline_stage": "serve",
  "latency_ms": 2100,
  "result": {
    "result_id": "2c07c6b3-6a3d-4f32-8a7e-abcdefabcdef",
    "outcome": "success",
    "output_text_length": 180
  },
  "meta": {
    "raw_message": "[REDACTED: original log text]",
    "parse": {
      "source": "api",
      "parser": "manual@1.0",
      "ok": true
    }
  }
}