{
  "timestamp": "2025-10-13T12:06:00Z",
  "request_id": "44444444-4444-4444-8444-444444444444",
  "model": "gpt-4-turbo",
  "pipeline_stage": "inference",
  "latency_ms": 1900,
  "category": "llm",
  "level": "info",
  "finish_reason": "length",
  "result": {
    "result_id": "66666666-6666-4666-8666-666666666666",
    "outcome": "failure",
    "error_code": "E0123",
    "error_message": "[SUMMARY: truncated due to max tokens]"
  },
  "meta": {
    "raw_message": "[REDACTED: original log text]",
    "parse": {
      "source": "api",
      "parser": "manual@1.0",
      "ok": true
    }
  },
  "usage": {
    "prompt_tokens": 256,
    "completion_tokens": 100,
    "total_tokens": 356
  },
  "sampler": {
    "max_tokens": 100
  }
}
