{
  "timestamp": "2025-10-13T12:05:00Z",
  "request_id": "11111111-1111-4111-8111-111111111111",
  "model": "gpt-4o",
  "pipeline_stage": "inference",
  "latency_ms": 850,
  "category": "llm",
  "level": "info",
  "result": {
    "result_id": "33333333-3333-4333-8333-333333333333",
    "outcome": "success",
    "output_text_length": 88
  },
  "meta": {
    "raw_message": "[REDACTED: original log text]",
    "parse": {
      "source": "api",
      "parser": "manual@1.0",
      "ok": true
    }
  },
  "usage": {
    "prompt_tokens": 42,
    "completion_tokens": 88,
    "total_tokens": 130
  }
}
